{
  "schemaVersion": 1,
  "revision": "e5504e014fa571dcbceda4c9ce7849426cd7867e7c1a0dcb9b4bb12a31ad2dfc",
  "publishedAt": "2026-06-22T00:00:00.000Z",
  "queues": {
    "eu-west-1": {
      "queueUrl": "https://sqs.eu-west-1.amazonaws.com/170533023216/go-execute-runbook.fifo",
      "queueArn": "arn:aws:sqs:eu-west-1:170533023216:go-execute-runbook.fifo",
      "stackName": "go-execute-runbook",
      "messageRetentionSeconds": 345600
    }
  }
}
