{
  "schemaVersion": 1,
  "revision": "b6cf118fb4637bce060c42b1d1c0f4a90b25c52d416296e64ca41d35fac420e3",
  "publishedAt": "2026-06-22T00:00:00.000Z",
  "queues": {
    "eu-south-1": {
      "queueUrl": "https://sqs.eu-south-1.amazonaws.com/170533023216/go-execute-runbook.fifo",
      "queueArn": "arn:aws:sqs:eu-south-1:170533023216:go-execute-runbook.fifo",
      "stackName": "go-execute-runbook",
      "messageRetentionSeconds": 345600
    }
  }
}
